{
  "$schema": "../../../schemas/gym/source-registry.schema.json",
  "registry_version": "0.1.2",
  "updated_at": "2026-08-22",
  "authority": "KINETIC repository machine state; Obsidian is a derived synthesis layer.",
  "training_definition": "Retrieval knowledge, DesignCases, abstract patterns, primitives/recipes, tool intelligence, evaluator and negative knowledge, source-to-output lessons, and Taste Memory; never foundation-model weight training.",
  "sources": [
    {
      "source_id": "src-cuvii-labs-motion",
      "name": "CUVII Labs Motion",
      "canonical_url": "https://labs.cuvii.dev/volume/motion",
      "domain": "labs.cuvii.dev",
      "source_kind": [
        "MOTION_REFERENCE"
      ],
      "knowledge_domains": [
        "motion",
        "transition",
        "interaction",
        "microinteraction"
      ],
      "license_status": "UNVERIFIED",
      "terms_url": null,
      "license_url": null,
      "rights_status": "VERIFY_REQUIRED",
      "ai_training_status": "EXPLICITLY_PROHIBITED",
      "automated_access": "PROHIBITED",
      "asset_copy": "PROHIBITED",
      "code_ingest": "UNKNOWN",
      "credential_required": false,
      "attribution_required": false,
      "license_retention_required": false,
      "inspection_quality": "DIRECTLY_INSPECTED",
      "last_verified_at": "2026-08-22",
      "evidence_urls": [
        "https://labs.cuvii.dev/volume/motion",
        "https://labs.cuvii.dev/robots.txt"
      ],
      "ingestion_modes": [
        "REFERENCE_ABSTRACTION",
        "NO_AUTOMATED_INGEST",
        "VERIFY_REQUIRED"
      ],
      "notes": "Page invites copying CUVII-authored code but acknowledges recreations and sometimes unknown original sources. No raw/code ingestion until terms and provenance are verified.",
      "audit": {
        "audit_id": "audit-cuvii-labs-motion",
        "source_id": "src-cuvii-labs-motion",
        "audited_at": "2026-08-22",
        "purpose": "Motion study/recreation gallery",
        "terms_review": {
          "status": "UNVERIFIED",
          "summary": "No official terms verified; silence is not permission.",
          "evidence_url": "https://labs.cuvii.dev/volume/motion"
        },
        "license_review": {
          "status": "UNVERIFIED",
          "summary": "No explicit reusable-content license verified.",
          "evidence_url": "https://labs.cuvii.dev/volume/motion"
        },
        "automation_review": {
          "status": "VERIFIED",
          "summary": "robots.txt allows search but disallows major AI crawlers and Cloudflare browser rendering.",
          "evidence_url": "https://labs.cuvii.dev/robots.txt"
        },
        "ai_training_review": {
          "status": "VERIFIED",
          "summary": "robots.txt publishes Content-Signal ai-train=no.",
          "evidence_url": "https://labs.cuvii.dev/robots.txt"
        },
        "commercial_use_review": {
          "status": "UNVERIFIED",
          "summary": "Commercial-use rights not verified for reusable ingestion.",
          "evidence_url": "https://labs.cuvii.dev/volume/motion"
        },
        "redistribution_review": {
          "status": "UNVERIFIED",
          "summary": "Redistribution rights not verified.",
          "evidence_url": "https://labs.cuvii.dev/volume/motion"
        },
        "credential_paywall_review": {
          "status": "UNVERIFIED",
          "summary": "Credential/paywall conditions not fully verified.",
          "evidence_url": "https://labs.cuvii.dev/volume/motion"
        },
        "structured_access_review": {
          "status": "UNVERIFIED",
          "summary": "No verified API/MCP/registry for reusable ingestion.",
          "evidence_url": "https://labs.cuvii.dev/volume/motion"
        },
        "inspection_quality": "DIRECTLY_INSPECTED",
        "recommended_ingestion_modes": [
          "REFERENCE_ABSTRACTION",
          "NO_AUTOMATED_INGEST",
          "VERIFY_REQUIRED"
        ],
        "evidence_urls": [
          "https://labs.cuvii.dev/volume/motion",
          "https://labs.cuvii.dev/robots.txt"
        ],
        "canonical_owner": "CUVII Labs",
        "third_party_ownership": {
          "status": "VERIFIED",
          "summary": "Page says original ideas/work may belong to other authors and sources are often unknown.",
          "evidence_url": "https://labs.cuvii.dev/volume/motion"
        },
        "conclusion": "Page invites copying CUVII-authored code but acknowledges recreations and sometimes unknown original sources. No raw/code ingestion until terms and provenance are verified."
      }
    },
    {
      "source_id": "src-60fps-design",
      "name": "60fps.design",
      "canonical_url": "https://60fps.design/",
      "domain": "60fps.design",
      "source_kind": [
        "MOTION_REFERENCE",
        "MCP",
        "LICENSE_GATED_LIBRARY"
      ],
      "knowledge_domains": [
        "motion",
        "transition",
        "interaction",
        "microinteraction",
        "tooling"
      ],
      "license_status": "VERIFIED_PROPRIETARY",
      "terms_url": "https://60fps.design/terms",
      "license_url": null,
      "rights_status": "LICENSE_GATED",
      "ai_training_status": "EXPLICITLY_PROHIBITED",
      "automated_access": "PROHIBITED",
      "asset_copy": "PROHIBITED",
      "code_ingest": "LICENSE_GATED",
      "credential_required": true,
      "attribution_required": true,
      "license_retention_required": false,
      "inspection_quality": "DIRECTLY_INSPECTED",
      "last_verified_at": "2026-08-22",
      "evidence_urls": [
        "https://60fps.design/",
        "https://60fps.design/pro",
        "https://60fps.design/terms"
      ],
      "ingestion_modes": [
        "REFERENCE_ABSTRACTION",
        "LICENSE_GATED_RUNTIME",
        "NO_AUTOMATED_INGEST"
      ],
      "notes": "Manual/public reference is permitted; Pro/MCP requires a personal key. Bulk/systematic copying, mirroring, standalone reference products, and ML training/testing/benchmarking/evaluation are prohibited. Third-party app brands/assets remain third-party property.",
      "audit": {
        "audit_id": "audit-60fps-design",
        "source_id": "src-60fps-design",
        "audited_at": "2026-08-22",
        "purpose": "Curated recordings and motion breakdowns from real iOS apps, plus licensed MCP",
        "terms_review": {
          "status": "VERIFIED",
          "summary": "Official Terms of Use last updated 2026-08-02 directly inspected.",
          "evidence_url": "https://60fps.design/terms"
        },
        "license_review": {
          "status": "UNVERIFIED",
          "summary": "No explicit reusable-content license verified.",
          "evidence_url": "https://60fps.design/"
        },
        "automation_review": {
          "status": "VERIFIED",
          "summary": "Terms prohibit bulk download or systematic copying by hand or script; only licensed MCP use is allowed within limits.",
          "evidence_url": "https://60fps.design/terms"
        },
        "ai_training_review": {
          "status": "VERIFIED",
          "summary": "Terms prohibit using 60fps to train, fine tune, test, benchmark, or evaluate an ML model.",
          "evidence_url": "https://60fps.design/terms"
        },
        "commercial_use_review": {
          "status": "VERIFIED",
          "summary": "Licensed users may use references for their own, employer/client, and product work, subject to restrictions.",
          "evidence_url": "https://60fps.design/"
        },
        "redistribution_review": {
          "status": "VERIFIED",
          "summary": "No mirroring, re-hosting, sublicensing, standalone reference library, or competing product.",
          "evidence_url": "https://60fps.design/"
        },
        "credential_paywall_review": {
          "status": "VERIFIED",
          "summary": "PRO/MCP requires a personal license key; current terms state two devices and 120 requests/minute.",
          "evidence_url": "https://60fps.design/"
        },
        "structured_access_review": {
          "status": "VERIFIED",
          "summary": "No verified API/MCP/registry for reusable ingestion.",
          "evidence_url": "https://60fps.design/"
        },
        "inspection_quality": "DIRECTLY_INSPECTED",
        "recommended_ingestion_modes": [
          "REFERENCE_ABSTRACTION",
          "LICENSE_GATED_RUNTIME",
          "NO_AUTOMATED_INGEST"
        ],
        "evidence_urls": [
          "https://60fps.design/",
          "https://60fps.design/pro",
          "https://60fps.design/terms"
        ],
        "canonical_owner": "60fps.design sole proprietorship, Bengaluru",
        "third_party_ownership": {
          "status": "VERIFIED",
          "summary": "Terms state app interfaces, brands, logos, copy and assets belong to app owners.",
          "evidence_url": "https://60fps.design/"
        },
        "conclusion": "Manual/public reference is permitted; Pro/MCP requires a personal key. Bulk/systematic copying, mirroring, standalone reference products, and ML training/testing/benchmarking/evaluation are prohibited. Third-party app brands/assets remain third-party property."
      },
      "tier_policies": [
        {
          "tier": "FREE_PUBLIC",
          "rights_status": "REFERENCE_ONLY",
          "code_ingest": "PROHIBITED",
          "credential_required": false,
          "notes": "Permitted public reference only; no systematic copying."
        },
        {
          "tier": "PRO_MCP",
          "rights_status": "LICENSE_GATED",
          "code_ingest": "LICENSE_GATED",
          "credential_required": true,
          "notes": "Read-only MCP under personal license and published rate limits; no bulk corpus."
        }
      ]
    },
    {
      "source_id": "src-transitions-dev",
      "name": "Transitions.dev",
      "canonical_url": "https://transitions.dev/",
      "domain": "transitions.dev",
      "source_kind": [
        "MOTION_REFERENCE",
        "IMPLEMENTATION_LIBRARY"
      ],